{
  "$schema": "../../schemas/case-schema.json",
  "case_id": "DFAPTI-AU-2026-00233",
  "title": "Mecca Brands Pty Ltd — Regulatory action",
  "created_date": "2026-07-23",
  "status": "ACTIVE",
  "category": "Regulatory action",
  "jurisdiction": "Australia",
  "investigation_objective": "Named in ASIC media release 26-057MR as one of three Mecca-group entities paying an infringement notice for allegedly failing to lodge an audited financial report by the statutory deadline.",
  "scope": "Received an ASIC infringement notice ($198,000) for alleged late lodgement of an audited financial report for FY ended 28 December 2024, per 26-057MR",
  "responsible_module": "dfapti",
  "primary_sources": [
    "ASIC"
  ]
}
